{
  "$schema": "./project-index.schema.json",
  "version": "1.0.0",
  "spec_version": "2.7.0",
  "source": "https://github.com/niclaslindstedt",
  "updated_at": "2026-05-16",
  "projects": [
    {
      "name": "zag",
      "description": "One CLI for Claude, Codex, Gemini, Copilot, and Ollama — keep your workflows stable even as agents change weekly.",
      "github": "https://github.com/niclaslindstedt/zag",
      "package": "https://crates.io/crates/zag-cli",
      "language": "Rust",
      "status": "active",
      "showcases": [
        {
          "section": "10.3",
          "title": "Release pipeline",
          "path": "examples/zag/10.3",
          "source_path": ".github/workflows/version-bump.yml, .github/workflows/release.yml, scripts/release.sh, scripts/generate-changelog.sh, scripts/update-versions.sh",
          "source_commit": "4a837b468c708dff517cdfa2a06187ad975d0438"
        },
        {
          "section": "3",
          "title": "README badge row",
          "path": "examples/zag/3",
          "source_path": "README.md",
          "source_commit": "54c70b93c7942b247acb98f8988e198aa44e2904"
        },
        {
          "section": "21.5",
          "title": "sync-oss-spec skill",
          "path": "examples/zag/21.5",
          "source_path": ".agent/skills/sync-oss-spec/",
          "source_commit": "54c70b93c7942b247acb98f8988e198aa44e2904"
        }
      ]
    },
    {
      "name": "zig",
      "description": "Describe workflows, share them, run them. A workflow runtime written in Rust.",
      "github": "https://github.com/niclaslindstedt/zig",
      "package": "https://crates.io/crates/zig-cli",
      "language": "Rust",
      "status": "active",
      "showcases": []
    },
    {
      "name": "zad",
      "description": "Agent adapter system — hook one agent up to several service providers through a uniform interface.",
      "github": "https://github.com/niclaslindstedt/zad",
      "package": "https://crates.io/crates/zad",
      "language": "Rust",
      "status": "active",
      "showcases": []
    },
    {
      "name": "ztf",
      "description": "End-to-end testing harness that uses `zag` verification to run complex flows against real agents.",
      "github": "https://github.com/niclaslindstedt/ztf",
      "package": "https://crates.io/crates/ztf",
      "language": "Rust",
      "status": "wip",
      "showcases": []
    },
    {
      "name": "juris",
      "description": "CLI that collects and normalises Swedish legal documents from official government sources.",
      "github": "https://github.com/niclaslindstedt/juris",
      "homepage": "https://niclaslindstedt.github.io/juris/",
      "package": "https://pypi.org/project/juris/",
      "language": "Python",
      "status": "active",
      "showcases": []
    },
    {
      "name": "spotifai",
      "description": "AI-augmented Spotify companion that uses LLMs to plan, curate, and explain listening sessions.",
      "github": "https://github.com/niclaslindstedt/spotifai",
      "status": "wip",
      "showcases": []
    },
    {
      "name": "cv",
      "description": "Personal site and CV for Niclas Lindstedt built with Vite, React, and TypeScript.",
      "github": "https://github.com/niclaslindstedt/cv",
      "homepage": "https://niclaslindstedt.se",
      "aliases": [
        "niclaslindstedt.se"
      ],
      "language": "TypeScript",
      "status": "active",
      "showcases": [
        {
          "section": "10.4",
          "title": "Website deployment",
          "path": "examples/cv/10.4",
          "source_path": ".github/workflows/pages.yml",
          "source_commit": "846ef7c814bf5b2f8661e151295d0d525e339159"
        },
        {
          "section": "14",
          "title": "Dependency hygiene",
          "path": "examples/cv/14",
          "source_path": ".github/dependabot.yml, .github/workflows/dependabot.yml, .agent/skills/fix-dependabot-prs/",
          "source_commit": "846ef7c814bf5b2f8661e151295d0d525e339159"
        }
      ]
    },
    {
      "name": "blog",
      "description": "Markdown blog rendered through a terminal-themed React frontend; content is authored and maintained by Claude skills.",
      "github": "https://github.com/niclaslindstedt/blog",
      "language": "TypeScript",
      "status": "active",
      "showcases": [
        {
          "section": "11.3",
          "title": "SEO and discoverability",
          "path": "examples/blog/11.3",
          "source_path": "website/src/seo/, website/scripts/seo/, website/scripts/generate-seo.ts, website/scripts/check-seo.ts, website/index.html, website/public/robots.txt, .github/workflows/seo.yml, .github/workflows/lighthouse.yml, .github/lighthouse/lighthouserc.json",
          "source_commit": "7c217084958f8d734e271f08b34bf4161dbc6d6d"
        }
      ]
    }
  ]
}
